"group","doc_id","unique_phrase_id","sentences","date"
1,202003251,"202003251_90","À bien des égards, nous faisons en sorte que les gens évitent les contacts. Nous ne pouvons pas encore sortir en catastrophe, jusqu'à présent, nous pensons pouvoir continuer ainsi. Les gens sont très réceptifs. Nous verrons si nous pouvons aller plus loin avec davantage de renforts, nous verrons si d'autres pays obtiendront de l'aide grâce à ces mesures. Encore une fois, j'étais ici hier, mais je dois poser une question : la situation est différente en Allemagne. En Allemagne, on discute d'une étude de l'université de Hong Kong, selon laquelle 44 % des personnes infectées le sont avant de présenter des symptômes. Cette étude porte sur une centaine de personnes. Cette étude fait le tour de l'Allemagne, ce qui signifie que les personnes ne présentant pas de symptômes peuvent être infectieuses. Vous voyez les choses différemment. Je suppose que c'est à cette étude que je pense, et qu'il ne s'agit pas de personnes sans symptômes, mais de cas sans papiers, c'est-à-dire de personnes qui ne se sont pas présentées aux services de santé. Nous plaçons la barre plus bas. Nous demandons aux personnes présentant des symptômes légers de rester chez elles, alors qu'elles n'auraient pas été prises en charge par le système de santé. Il est évident que si l'on inclut ces personnes, on obtient un groupe assez important qui peut être infectieux. Il est certain que des personnes ne présentant aucun symptôme peuvent être infectées, mais c'est très rare par rapport à la quantité d'infection transmise par les personnes présentant des symptômes. ""Nous ne cherchons pas à éliminer complètement l'infection, la maladie est là pour rester, mais nous voulons la réduire autant que possible. Nous devons aplanir la courbe et faire fonctionner le système de santé. Nous estimons que cela peut se faire en éliminant les personnes qui présentent des symptômes. Vous pouvez infecter quoi que vous fassiez - nous n'avons pas la possibilité d'éliminer l'infection de la société. Nous devons réglementer et donner les bons conseils afin de réduire la propagation de l'infection. C'est l'idée et la stratégie qui sous-tendent notre action. Je crois qu'il s'agit d'une autre étude, qui a examiné des couples dont les deux membres sont atteints de la maladie, et dont l'un d'entre eux l'a contractée en premier, puis ils ont testé le temps nécessaire. - Je l'ai vu aussi.","2020-03-25"
1,202003301,"202003301_165","Vous devrez demander au Conseil suédois de la sécurité, mais pour autant que je sache, il est pratiquement prêt. Je suis un représentant de la sécurité dans le domaine des soins aux personnes âgées, et je suis actif dans les municipalités. Comment puis-je assurer la sécurité de mes collègues ? Un exemple : dans mon bureau, il y a une personne infectée. On s'est interrogé sur l'équipement à utiliser. Mais si vous vous adressez au 1177, on vous dit qu'il faut attendre d'avoir des symptômes. Ne devriez-vous pas agir différemment pour prévenir le risque d'infection ou la propagation de l'infection dans la maison de repos ? Comment pensez-vous qu'il en soit ainsi ? Lorsqu'il y a une personne infectée, le personnel doit-il être testé ? Ne devriez-vous pas agir plus rapidement ? Pourquoi attendre que la personne présente des symptômes ? Deux réponses : premièrement, il incombe toujours au lieu de travail et à l'employeur d'élaborer un plan qui fonctionne au niveau local et qui soit ancré, afin que les employés se sentent en sécurité. Deuxièmement, vous ne devriez pas ou ne pouvez pas tester des personnes qui ne présentent pas de symptômes, les tests ne sont pas conçus pour cela. Merci d'être venus, vous pouvez vous détendre maintenant lorsque vous vous présentez et posez des questions","2020-03-30"
1,202004011,"202004011_49","Stockholm a examiné de plus près la situation et vérifie si toutes les personnes diagnostiquées sont décédées dans le registre des décès. Cela signifie que nous aurons à l'avenir un nombre de décès apparemment plus élevé qu'auparavant. Les personnes décédées sont principalement des personnes très âgées, comme c'est le cas dans d'autres pays. Le fait qu'il y ait ensuite des cas occasionnels dans d'autres groupes d'âge est normal lorsqu'il s'agit d'une maladie commune à tous les groupes d'âge. Il est important aujourd'hui de ne pas sortir de la courbe jaune, mais de continuer à rester sur la courbe bleue, afin que notre système de soins de santé ait la possibilité de soutenir cette évolution à l'avenir. N'oubliez pas de rester à la maison au moindre symptôme, et n'oubliez pas que nous devons protéger nos personnes âgées encore plus qu'aujourd'hui. Johan - Je vous remercie. Je voulais répéter ce que j'ai dit lors de la conférence de presse qui s'est tenue il y a une heure au siège du gouvernement, à savoir que nous avons décidé aujourd'hui de règlements et de conseils généraux concernant les mesures. Cela fait partie d'un ensemble plus large de règlements que vous avez vus. Le gouvernement a décidé d'abaisser le seuil d'organisation des rassemblements publics de 500 à 50 personnes. Des décisions ont été prises concernant les ordonnances restrictives dans les maisons de repos et les établissements de soins, à quelques exceptions près bien sûr, qui seront traitées au niveau local. Nous avons déjà été très clairs sur le fait que toutes les personnes qui présentent les moindres symptômes du COVID-19 doivent rester chez elles et éviter les contacts sociaux. Ces conseils et ces règlements visent à combler les lacunes des règlements. Nous avons déjà communiqué une grande partie de ces informations, par exemple sur notre site web, lors de conférences de presse, etc. Tout d'abord, sur la base de l'ordonnance sur la prévention des infections, nous prescrivons que toutes les activités, c'est-à-dire les entreprises publiques et privées, les municipalités, les activités municipales, les associations et les communautés religieuses, doivent veiller à prendre les mesures appropriées pour limiter la propagation de l'infection. C'est une exigence pour les opérateurs. Les mesures doivent alors être basées sur les recommandations de l'autorité ou du médecin spécialiste des maladies infectieuses ou sur d'autres connaissances disponibles.","2020-04-01"
2,202004011,"202004011_292","Notre message est de bouger davantage, de faire plus d'exercice, mais dans des conditions sûres, afin de prévenir les effets négatifs de la promiscuité. Comment, en tant qu'organisateur d'un entraînement de football ou d'un événement alimentaire, pouvez-vous garantir les conditions requises pour réduire la propagation des infections ? Par exemple, qu'il y ait des espaces pour l'hygiène. Discutez de l'importance de l'hygiène. Si le contact corporel est nécessaire pendant l'entraînement, par exemple. Et qu'il n'y ait pas d'enfants, de jeunes ou d'adultes présentant des symptômes. Et même dans ces groupes, il y a des groupes à risque qui sont inclus dans la réglementation. Ces conseils doivent être lus dans leur intégralité ; ils s'adressent également aux organisateurs. Si vous ne pouvez pas organiser la manifestation, c'est une bonne chose qu'elle soit annulée ; si vous pouvez l'organiser, c'est une bonne chose que vous fassiez du sport"".","2020-04-01"
1,202004021,"202004021_161","Nous constatons également que des personnes meurent de la grippe ordinaire à un jeune âge, mais cela n'est pas reconnu"" -Gothenburgsposten, vous avez tenu une réunion hier sur l'élargissement des tests. Nous avons reçu une mission du gouvernement sur cette question, que nous sommes en train d'analyser. Je n'ai pas participé à la réunion, mais des solutions auraient dû être trouvées. Cela ne se fera pas en un jour, mais il est important de mettre en adéquation les moyens mis à disposition, du côté des laboratoires, avec les moyens mis à disposition du côté des soins de santé. Ce travail a commencé. Nous continuerons à donner la priorité au dépistage de toutes les personnes qui se présentent aux services de santé avec des symptômes. Cela nous permettra de mieux tester les personnes qui travaillent avec les personnes âgées - c'est très bien, et ce sera une priorité. Ensuite, nous examinerons les possibilités et les besoins des différents secteurs socialement importants à tester. Mais c'est un grand appareil"" - Ekot ici : Un tiers des personnes en maison de retraite sont infectées, montre Ekot... - Un tiers des maisons de retraite de Stockholm ont eu des cas, je crois. C'est une grande différence - Il y a aussi un grand nombre de cas confirmés dans les services de soins à domicile. La stratégie de l'Agence de santé publique a été de construire un mur autour des personnes âgées, cela n'a pas fonctionné, quelle est la gravité de la situation ? - Très grave, bien sûr.","2020-04-02"
2,202004021,"202004021_178","Mais nous avons un dialogue continu à ce sujet, parce que c'est la base pour discuter de la façon de s'améliorer. Même si le problème n'est pas aussi grave dans d'autres régions du pays qu'à Stockholm, il peut y avoir des problèmes similaires. Y a-t-il lieu de fixer des exigences plus claires en matière d'équipement de protection dans les maisons de repos ? Nous ne savons pas si c'est l'équipement de protection qui pose problème. L'expérience montre qu'il n'y a pas d'exigences particulièrement élevées en matière d'équipement de protection dans cet environnement particulier. Ici, ce sont probablement les rencontres avec des personnes infectées qui sont la cause principale - le travailleur municipal : J'ai parlé à du personnel de soins à domicile qui m'a dit qu'il n'utilisait pas d'équipement de protection s'il recevait des personnes présentant des symptômes respiratoires sans savoir de quel type de maladie il s'agissait - Lorsqu'il s'agit de savoir quel équipement de protection utiliser pour différentes tâches, c'est le superviseur qui fait l'analyse et qui doit veiller à ce que l'équipement de protection soit disponible. Nous avons ce dialogue avec les régions et les municipalités du pays. Mais ce n'est pas nous qui vous dirons exactement ce dont vous avez besoin dans chaque situation, c'est vous qui devez le faire là où vous travaillez - pour pouvoir décrire la situation, pour pouvoir obtenir des conseils sur ce dont vous avez besoin. Surtout, parce que vous devez utiliser l'équipement de protection là où il est nécessaire, et non ""pour la sécurité"". ""C'est tellement contradictoire que ça n'existe pas"", dit quelqu'un. ""Nous ne devrions pas aller au travail si nous toussons, mais nous devrions aller voir un retraité même s'il tousse"".","2020-04-02"
1,202004061,"202004061_34","Toutes les régions y ont accès, ce qui permet d'adapter la planification aux nouvelles données, qui devraient refléter la situation en Suède un peu mieux que les données chinoises. Mais nous verrons avec le temps. Nous travaillons à l'aplanissement de la courbe, je pense que nous y sommes parvenus, vous pouvez voir certains effets que d'autres influences cessent de circuler, nous avons une bonne part du nombre de lits d'hôpitaux dont Johanna Sandwall parle plus en détail. C'est ce qui nous préoccupe le plus aujourd'hui : le fait que nous ayons introduit l'infection dans tant de maisons de retraite, en particulier à Stockholm. C'est très triste à bien des égards - les personnes sont gravement touchées par cette situation - beaucoup perdent des proches. Il est très important que toutes les personnes concernées retournent dans leur organisation et réfléchissent à ce qu'elles peuvent faire de mieux - le personnel devrait se rendre à domicile au moindre symptôme, nous nous efforçons de faire en sorte que les personnes soient testées afin qu'elles sachent ce qu'elles ont, et il est important qu'elles suivent les routines de base pour réduire la propagation de l'infection. Nous cherchons, avec d'autres et avec les gouvernements, à examiner de plus près certaines maisons de retraite afin d'avoir une meilleure idée de ce que nous pouvons faire pour arrêter la propagation de l'infection, mais il s'agit d'une préoccupation majeure et d'une des principales raisons de la mort. Mes collègues nordiques n'ont pas le même problème - la question de savoir s'ils sont meilleurs est en cours de discussion. C'est blanc quand on parle d'équipements de protection - ils ne résolvent pas les problèmes, surtout dans les maisons de retraite, où le maintien à domicile en cas de maladie reste la base - si vous voulez arrêter la propagation de l'infection entre les patients, ce sont les routines d'hygiène de base qui sont importantes - désinfectant pour les mains, lavage des mains et équipements de protection. C'est la chose la plus importante dans les maisons de retraite. Pour protéger le personnel, il existe différents types de respirateurs.","2020-04-06"
2,202004061,"202004061_98","Nous sommes en train d'analyser les résultats de l'étude. Dans deux jours. - D'ici la fin de la semaine ? - Oui. - A partir de Tt. J'allais poser une question sur le fait que Boris Johnson est tombé malade et qu'il est soigné, mais on ne sait pas si c'est grave. En Suède, Stefan Löfven dit qu'il n'a pas été testé parce qu'il n'a pas de symptômes. Quelle est l'opinion de l'Agence de santé publique de Suède, le gouvernement frontalier, sur le test de dépistage du coronavirus ou le test de dépistage des personnes qui en sont atteintes ? Il serait très dangereux.","2020-04-06"
3,202004061,"202004061_107","- Oui. -Josef Svenberg de D N. A propos des masques.","2020-04-06"
4,202004061,"202004061_112","Non. La base est ferme : les masques doivent être utilisés là où c'est nécessaire - dans les soins de santé, où l'on peut créer des situations où l'on peut propager une infection que l'on ne peut prévenir qu'avec une protection respiratoire adéquate, c'est là qu'ils doivent être utilisés. Dans la communauté ? Rien n'indique qu'ils protègent. Il s'agit de ne pas propager l'infection soi-même. Il existe une possibilité théorique - mais nous disons qu'il faut rester à la maison si l'on a des symptômes - alors que dans ces pays, on dit qu'il faut porter un masque si l'on tousse - mais étant donné que l'on peut transmettre l'infection si l'on est asymptomatique, le port d'un masque ne présente-t-il pas un intérêt ? - Je pense qu'il faut s'en tenir à l'essentiel - rester à la maison si l'on est malade. Les raisons de l'infection, il y en a, mais la proportion varie beaucoup d'une étude à l'autre, semble se situer autour de 10 %, ce qui est peu. L'important est de se débarrasser du plus grand nombre possible d'infections pour que le système de santé puisse fonctionner ; si nous pouvons nous débarrasser des 90 % de personnes infectées qui présentent des symptômes, c'est la meilleure chose à faire. Créer un faux sentiment de sécurité avec des masques peut être très négatif. Mia Pettersson, G P. À propos de la protection non approuvée, y a-t-il quelque chose de particulier qui vous a incité à demander une protection non approuvée ? Oui, il y a eu une grande discussion avec beaucoup de gens, et certains dans les médias, sur le fait que nous refusons des contrats assez importants, avec d'autres pays, et surtout lorsque nous ne jugeons pas qu'ils ont la bonne qualité. Voilà pour le contexte.","2020-04-06"
1,202004071,"202004071_254","Pour le personnel et les personnes qui sont en meilleure santé, qui passent normalement du temps avec les enfants et qui rencontrent probablement de nombreux virus au quotidien, nous considérons que le risque est faible. Nous n'en voyons pas du tout ici. - Nous allons réessayer avec Sydsvenskan sur le lien. - Vous m'entendez maintenant ? Bonjour ! J'ai une question pour Anders Tegnell : L'Agence suédoise de santé publique recommande clairement que même les personnes qui ne sont pas infectées ou qui n'ont pas de symptômes évitent les voyages inutiles. Dans le même temps, le conseil régional de Scanie a déclaré qu'il n'y avait pas de problème à voyager à Pâques, à condition que ce soit à l'intérieur de la Scanie. Êtes-vous d'accord ? Quand il s'agit de voyager, il s'agit de prendre ses responsabilités et de se demander si le voyage est vraiment nécessaire. Mais il faut absolument éviter de se rendre chez des parents âgés. Il est également déconseillé de se rendre à de grands événements.","2020-04-07"
1,202004081,"202004081_50","Nous ne savons pas combien d'entre eux y vivent. Parmi les personnes décédées, 40 % se trouvent dans des maisons de retraite. Nous n'avons pas constaté cette évolution dans le reste du pays. Là-bas, seuls 5 % vivaient dans une maison de repos, et 4 % des personnes décédées vivaient dans une maison de repos. Ce sont des chiffres importants et nous continuerons à les analyser. On a beaucoup discuté, notamment après les informations de ce matin, de la question de savoir qui est infectieux et qui ne l'est pas, ce qui est asymptomatique et ce qui ne l'est pas. L'OMS continue de dire - et nous l'avons toujours dit - que les personnes infectées sont principalement celles qui présentent des symptômes. Il est bien connu que de nombreuses personnes qui contractent la maladie ne présentent pas de symptômes, mais nous ne le savons pas. On dit que 90 % des personnes infectées ne présentent pas de symptômes. Cependant, ces personnes sont relativement rarement infectées. Quelques études, dont une de taille moyenne réalisée à Singapour, indiquent qu'environ 6 à 8 % des personnes infectées ne présentent pas de symptômes. Nous pouvons convenir que toute personne présentant des symptômes reste à la maison et nous éliminerons largement l'infection de la société. L'OMS a clairement indiqué que les masques de protection devaient être utilisés dans le cadre des soins de santé. L'utilisation de masques dans la société est une mesure difficile à mettre en place. Nous savons que si vous présentez des symptômes et que vous êtes malade du COVID-19, un masque facial peut vous protéger contre la propagation de l'infection aux personnes qui vous entourent. Certaines études menées à Hong Kong le suggèrent, mais rien ne prouve qu'il vous protège contre l'infection. Une fois de plus, les preuves suggèrent fortement que si vous avez des symptômes, vous devriez rester à la maison. Cela réduira considérablement la propagation de l'infection. Enfin, notre message principal : si vous avez des symptômes au réveil, restez chez vous. Évitez les contacts sociaux. Si vous avez plus de 70 ans, restez chez vous. Sortez, mais évitez autant que possible les contacts sociaux. Nous avons un certain nombre d'autres mesures à prendre : L'hygiène des mains, le maintien de la distance au sein de la communauté, comme nous l'avons vu dans les photos récentes, sont des éléments importants. Je reçois beaucoup de courriels me disant que les gens ne pensent pas que cela fonctionne si bien.","2020-04-08"
2,202004081,"202004081_108","Nous devons modifier notre comportement de diverses manières pour arrêter la courbe et ne pas surcharger le système de soins de santé. Nous n'y sommes pas encore, mais nous sommes sur la bonne voie. Nous sommes conscients que de nombreuses personnes font des sacrifices dans le cadre de ces changements, mais en résumé, nous pouvons dire que nous travaillons bien ensemble, et je voudrais remercier tous ceux qui contribuent à ce travail commun. Je le répète : continuez à suivre les conseils des autorités, soyez critiques à l'égard des sources et obtenez des informations sur krisinformation.se, toute personne souhaitant approfondir ces tableaux peut le faire sur le site web de la MSB. Questions -TT, une question pour Anders Tegnell. Dans le secteur des soins de santé, de plus en plus de personnes asymptomatiques sont testées. On obtient des chiffres assez spectaculaires, comme à l'hôpital universitaire de Linköping, où un grand nombre de personnes avaient le virus mais ne présentaient aucun symptôme. ""Plusieurs pour cent ne présentent pas de symptômes, ce qui est infectieux et propage la maladie, comme je l'ai dit. Mais cela signifie-t-il que les personnes testées positives dans le secteur de la santé devraient continuer à travailler dans ce secteur ? Non, ces chiffres de Linköping ne sont pas dramatiques. Ce qui est peut-être surprenant, c'est qu'il y ait autant de personnes présentant des symptômes. Il n'y a pas beaucoup de personnes qui ont été testées aussi largement. Et non, il ne faut pas prendre ce risque, surtout dans les soins de santé. Ils suivent la même routine que les autres personnes présentant des symptômes, à savoir qu'ils doivent attendre avant de reprendre le travail. Au moins 2 jours sans symptômes ou 7 jours au total. -Ils ne peuvent pas travailler avec un bain de bouche ou quelque chose comme ça ? -Non, c'est un risque que nous ne pouvons pas prendre. -Est-ce qu'il y a un risque de paralyser le système de santé parce que tant de gens doivent s'absenter ? -C'est quelque chose que nous devons gérer au fur et à mesure, il n'y a pas de signes de propagation de l'infection dans le système de santé en général. Il s'agit probablement d'une personne qui a beaucoup infecté.","2020-04-08"
3,202004081,"202004081_166","Il est important de le faire d'une bonne manière, afin d'apprendre quelque chose et de transmettre nos expériences à d'autres régions du pays. J'espère que cela ne se reproduira pas - Bonjour, SVT Nyheter. Une question sur la perspective temporelle. Vous devriez commencer à faire plus de tests. J'ai cru comprendre que vous seriez en mesure d'effectuer environ 100 000 tests par semaine dans quelques semaines. J'ai cru comprendre que vous testiez le personnel et les personnes travaillant dans le secteur de la santé, mais les personnes asymptomatiques... Il existe d'autres tests. Ils ne font pas partie des 100 000 tests. Ce sont les régions qui pourront mettre en œuvre, pas nous. Mais d'ici quelques semaines, nous en examinerons quelques-uns et verrons s'ils fonctionnent bien. J'espère que nous disposerons bientôt de quelque chose pour mesurer l'immunité dans la population, mais c'est plus difficile au niveau individuel.","2020-04-08"
4,202004081,"202004081_215","- Je ne sais pas. D'habitude, nous avons quelque chose comme ça. Je ne sais pas. Il pourrait y en avoir plus, mais c'est une moyenne. - De Tv4 à Anders Tegnell. Je comprends que ce sont principalement les personnes infectées ou les personnes présentant des symptômes qui peuvent infecter d'autres personnes, mais plus tôt dans la journée, vous avez dit que jusqu'à 9 personnes sur 10 qui ont l'infection sont asymptomatiques, qu'est-ce que cela indique ? Nous ne le savons pas, car les tests n'ont été effectués sur aucune population dans le monde - nous ne savons donc pas combien de personnes ont été infectées en Chine ou en Italie. Ce ""9 sur 10"" est une spéculation des experts, c'est comme la grippe ordinaire, d'autres virus ont un niveau plus élevé. Nous verrons s'il est là, il pourrait être plus ou moins élevé, mais nous nous basons sur la grippe ordinaire"" - Au sujet des logements pour personnes âgées, si la propagation a été si spectaculaire, que peut-on faire pour la ralentir maintenant ? -De nombreuses personnes y réfléchissent - Attendo et de nombreux fournisseurs - un certain nombre de mesures peuvent être prises - tester davantage le personnel est probablement une bonne chose, former le personnel, revoir les procédures, garantir des possibilités d'isoler les malades, travailler avec des ""soins à court terme"" - que le même personnel ne s'occupe pas d'un trop grand nombre de personnes âgées en utilisant certains horaires, il y a de nombreuses mesures, nous ne savons pas ce qui a été fait dans certains domaines, nous essayons de mieux maîtriser la situation. -Est-ce que tout le personnel devrait être testé pour être sûr ? Oui, c'est le problème : les tests ne sont bons que si vous les faites, pas si vous n'avez pas de symptômes, donc vous pouvez très bien être négatif, puis positif, un test négatif ne vous dit rien sur le moment, il n'est vraiment important que si vous avez des symptômes. - Agence de presse. Anders Tegnell : Hier soir, Trump a déclaré que la Suède souffrait énormément. Tout le monde souffre en ce moment. Les soins de santé suédois sont de bonne qualité et comptent parmi les meilleurs au monde. Quels sont les effets d'une diminution de l'exercice physique ?","2020-04-08"
