"group","doc_id","unique_phrase_id","sentences","date"
1,202004101,"202004101_26","Je voudrais vous rappeler qu'il est important d'aplanir la courbe pour que le système de santé puisse traiter les cas qui arrivent. Et qu'il est extrêmement important de prendre des mesures dans la communauté - c'est la base des conséquences pour les soins de santé. Nous avons rendu compte hier d'une enquête menée à Stockholm sur le nombre de personnes atteintes d'une infection active par le COVID-19 au sein de la communauté. Ce chiffre est d'environ 2,5 % à Stockholm. Nous souhaitons aujourd'hui attirer l'attention sur les chiffres que nous observons dans le cadre de la surveillance sentinelle de la grippe, qui est désormais la surveillance du COVID-19. Au cours des semaines 12 et 13, environ 7 % des cas de COVID-19 ont été enregistrés chez les personnes présentant des symptômes respiratoires. Au cours de la semaine 14, nous avons enregistré 14 % de ces cas dans les services de soins ambulatoires. Stockholm et Uppsala ont enregistré la plus forte proportion de cas positifs, ainsi que Halland, mais Skåne et Västra Götaland ont connu des niveaux de surveillance sentinelle relativement faibles. Plusieurs régions ne participent pas et le nombre de cas est relativement faible. Il s'agit d'un des nombreux systèmes qui nous aident à suivre l'évolution de la situation. Nous avons également mentionné précédemment que nous voyons dans les mesures d'autres infections virales que les mesures prises dans la société ont eu des effets clairs sur les mesures que nous prenons.","2020-04-10"
2,202004101,"202004101_38","La courbe inférieure s'infléchit après la semaine 12, ce qui indique que les mesures ont un effet sur les infections respiratoires virales. Dans la courbe inférieure, nous avons également montré l'impact sur les vomissements hivernaux, où les barres plongent fortement pour l'année. Nous avons ajouté le virus RS, qui est également une infection respiratoire virale ; vous voyez la courbe turquoise qui plonge brusquement. Ce sont des signes que les mesures ont un effet, et cela montre que nous devons poursuivre nos efforts. Ce qui s'applique au public : si vous présentez des symptômes de COVID-19, restez chez vous et évitez les contacts sociaux. Ces symptômes vont des symptômes respiratoires à la congestion nasale, aux maux de gorge et aux maux de tête, mais peuvent aussi inclure de la fièvre, des nausées et des symptômes gastro-intestinaux. Restez chez vous. Si vous avez plus de 70 ans, vous subissez une pression supplémentaire. Il est important de rester chez soi et d'éviter les contacts sociaux. Se déconnecter de la société. Restez chez vous, c'est-à-dire profitez du soleil, mais ne fréquentez pas d'autres personnes, restez à l'écart.","2020-04-10"
1,202004151,"202004151_117","Mais il y a un retard plus important, il faut être encore plus prudent. Il s'est rempli par derrière, mais le graphique ne pointe pas comme avant le week-end."" ""Avez-vous une analyse de ce qui s'est bien passé pendant le week-end ?"" ""Comme les cas qui sont dans les hôpitaux et ceux qui décèdent sont une image de ceux qui sont tombés malades il y a des semaines, il est difficile de dire que c'est Pâques qui l'a influencé. Mais les mesures prises et les conseils généraux peuvent avoir eu un effet. Mais nous voulons analyser cela et d'abord confirmer qu'il s'agit d'un changement durable"" -Ekot, une question adressée à la DGSM, qui présentera une enquête nationale demandant au public de signaler les symptômes de la maladie. Comment s'assurer que les personnes âgées, par exemple, répondent à l'enquête ? Mais techniquement, l'outil a été développé, ce n'est pas le problème. Mais l'enquête nationale sera un soutien pour le contrôle des infections et le travail de communication, afin de cibler et d'adapter les efforts de manière adéquate. Il sera également possible de signaler les symptômes d'autres personnes dans cet outil. L'idée est de créer une base de données qui ne contiendra pas de données traçables, mais qui sera anonyme. D'autres questions ? Oui, Dagens Nyheter. Je m'interroge un peu. Le positivisme prudent existe depuis un certain temps.","2020-04-15"
2,202004151,"202004151_178","Il y a des points de vue différents. Mais nous avons fait ce que nous croyons en matière de lutte contre les infections"" - Autre question du Göteborgsposten. Le fait que les choses s'améliorent un peu pourrait-il être lié au fait que l'on n'analyse pas de la même manière pendant les week-ends ? Non, j'ai du mal à le croire. Il s'agit de patients et ils doivent être testés. Toutefois, nous devons être prudents à l'avenir, par exemple avec le personnel qui présente des symptômes légers. Cela peut entraîner une fausse augmentation du nombre de cas. ""Nous distinguons les cas qui sont testés pour des raisons autres que la maladie. Nous devons suivre la courbe pour ne pas changer notre stratégie d'échantillonnage"" - C'est bon, nous allons continuer à faire des interviews à l'extérieur aussi. Très bien, tout le monde dehors.","2020-04-15"
1,202004171,"202004171_43","L'objectif de la stratégie est de disposer d'une capacité nationale, sûre, durable et solide pour l'échantillonnage et le diagnostic prioritaires de COVID-19. Mais aussi de disposer d'une capacité nationale élargie pour l'échantillonnage et l'analyse de laboratoire, pour COVID-19, pour le personnel. De disposer d'une capacité élargie pour l'échantillonnage et l'analyse de laboratoire pour les fonctions importantes sur le plan social. Que nous ayons une image de la propagation et de l'occurrence dans la société. Une capacité accrue dans d'autres parties de la société, là où cela a un effet. La stratégie d'aujourd'hui, où vous devez être à la maison au moindre symptôme, pour éviter d'infecter les autres, a des conséquences dans les activités socialement importantes et dans l'ensemble du commerce et de l'industrie. Je veux montrer à nouveau l'ordre de priorité. Il est toujours vrai, et c'est extrêmement important, que ce sont les patients atteints d'une maladie aiguë qui sont soignés, le groupe à risque, et ceux qui vivent dans des institutions. Cela ne doit pas avoir pour effet de déplacer le groupe prioritaire. Mais nous devons augmenter la capacité du personnel dans les soins de santé et les services sociaux. Il ne s'agit pas de tests de masse pour la population, mais d'un système d'analyse et de diagnostic soigneusement classé par ordre de priorité.","2020-04-17"
2,202004171,"202004171_59","Lavez-vous les mains avec de l'eau et du savon. Évitez les grands événements. Gardez vos distances, à l'intérieur comme à l'extérieur. Évitez les voyages inutiles. Restez chez vous si vous vous sentez un peu malade. Il est extrêmement important de prendre en compte les symptômes bénins. Nous avons déjà mené une enquête à Stockholm pour déterminer le nombre de personnes infectées au cours de la semaine 14. Nous avons analysé les symptômes de plus près, ce à quoi je répondrai plus tard. Cela montre qu'il est important de tenir compte des symptômes bénins. 70 ans et plus - restez chez vous, évitez les contacts sociaux - Je commencerai par faire le point sur la situation des soins intensifs en Suède. Aujourd'hui, le nombre de lits est de 1072, soit un doublement par rapport à la situation initiale, et il est donc prévu d'augmenter encore le nombre de lits de soins intensifs. Le nombre de personnes soignées reste à peu près le même. C'est la partie orange de la barre, 328 patients, et la partie jaune... ? 528 est à, pardon, tous les autres patients sont à 328.","2020-04-17"
3,202004171,"202004171_131","Nous nous tournons vers l'avenir pour tenter d'identifier les risques éventuels que les municipalités, les régions, les entreprises ou les organisations doivent gérer et auxquels elles doivent se préparer le plus tôt possible. Le tableau de la situation de cette semaine est similaire à celui de la semaine dernière, nous ne voyons pas de changements majeurs. Cela signifie qu'il y a un impact sur les activités socialement importantes, dans la plupart des secteurs de la société. En général, il est modéré, si l'on exclut les soins de santé et les soins, qui sont affectés dans une plus large mesure, comme le Conseil national de la santé et du bien-être le signale régulièrement ici. Les problèmes les plus courants, dans la plupart des services essentiels, sont liés à l'absence du personnel - beaucoup sont absents pour cause de maladie ou de congé de maternité. Cela inclut les symptômes légers. L'ampleur du problème varie d'une organisation à l'autre et à l'intérieur d'une même organisation, et dans certaines organisations, on signale une réduction de l'impact parce que le personnel a repris le travail. Il y a des hauts et des bas. Dans l'ensemble, l'impact est modéré ; la société fonctionne. Un travail systématique est en cours pour garantir que les activités socialement importantes fonctionneront au fil du temps, même en cas d'absence importante du personnel.","2020-04-17"
4,202004171,"202004171_231","Les plaintes, lex Maria, etc. restent inchangées. Il y a donc toujours une évaluation à faire : ""Qu'est-ce qu'il est raisonnable de demander aux organisations ? Qu'elles prennent leurs responsabilités face aux différents risques et effets. Ce n'est pas une question de oui ou de non. Nous devrons suivre cela et nous adapter en fonction des différentes conditions qui existent dans les régions. Aftonbladet : Karin, vous avez mentionné l'enquête de Stockholm et le tableau des symptômes, quelle est votre analyse ? Dans l'enquête actuelle, il y avait un peu plus de 700 personnes qui ont participé au total, dont 18 avaient des résultats positifs et la détection du covid-19. 2,5 %. Les résultats ont été répartis uniformément entre les différents groupes d'âge que nous avons étudiés, qui sont au nombre de quatre. En ce qui concerne les symptômes, nous avons en partie mesuré les symptômes perçus avant le prélèvement sanguin. Étant donné que très peu de personnes ont montré des traces de COVID-19, cela signifie que toutes les personnes positives ont signalé un symptôme. Certains se sont distingués, parce que des personnes ont signalé des symptômes même dans le groupe négatif. Il y a maintenant des rhumes. Nous avons comparé les symptômes et certains d'entre eux étaient aussi fréquents dans les deux groupes. Mais certains étaient intéressants et indiquaient que quelque chose se distinguait particulièrement. Lorsque nous ferons l'enquête en Suède et que nous obtiendrons plus de données au cours de la semaine 17... Une chose pour laquelle nous n'avons pas trouvé de signification est la perte d'odorat et de goût et la diarrhée, qui était plus élevée dans le groupe négatif que dans le groupe positif. Beaucoup de ceux qui ont ressenti les symptômes du rhume ou de la grippe ont douté de ce qu'ils avaient pris pour quelque chose. Sur la base de ces résultats, pouvez-vous dire quelque chose sur le tableau des symptômes qui pourrait aider les gens à s'auto-diagnostiquer ? Non, mais cela confirme ce que nous disons, à savoir qu'il faut rester à la maison si l'on a le moindre symptôme, et voir si cela s'aggrave. Ensuite, on observe que la perte de l'odorat et du goût semble typique. Elle ne se produit pas dans les 18 cas positifs, mais dans une proportion assez importante parmi les cas positifs, mais pas dans les cas négatifs. Il n'est pas pathognomonique de penser que la perte de goût et d'odorat est due au COVID-19. Ce sont des symptômes que les gens ont de temps en temps. C'est une observation, pour ainsi dire. Pour savoir si vous avez eu l'infection, nous devons voir s'il y a une signification plus claire dans les symptômes. Et nous ne serons pas en mesure de dire si vous avez eu l'infection simplement à partir des symptômes. Il s'agit d'une étude importante pour voir à quoi ressemblent les symptômes dans les cas bénins. Une grande partie de ce qui est rapporté aujourd'hui provient du système de soins de santé, et vous avez souvent des cas graves, tels que l'essoufflement et la toux. Ils se produisent également chez nous, mais ils ne ressortent pas dans le projet pilote. Dans la stratégie de test, dans la première version, nous nous sommes concentrés sur l'affichage du virus et du génome. Dans une nouvelle version, nous mettrons l'accent sur la détection des anticorps, pour montrer que vous avez eu une infection continue. Nous espérons que cela permettra de dire si vous avez subi l'infection ou non. SvD : J'ai déjà interrogé Anders Wallensten sur les symptômes liés au tractus gastro-intestinal, et il m'a répondu : ""Plus tard, comme s'il n'était pas nécessaire d'y prêter attention au début"". Les choses ont-elles changé en ce qui concerne la diarrhée ? La cinétique, au cours du traitement, n'est pas incluse. Il n'y a pas assez de données. Nous avons demandé les symptômes 14 jours auparavant, et le moment où l'échantillon a été prélevé. Mais pas où vous en êtes dans le traitement. Dans les études précédentes, en Chine, il y a eu des rapports de nausées et ainsi de suite, mais c'était une petite proportion -C'est un symptôme important, absolument. Le dépistage, qui est maintenant tellement étendu, était-ce une mauvaise décision lorsque vous avez vu l'infection sociale, de ne pas tester le personnel de santé et de soins sociaux dans les maisons de retraite ? Non, la stratégie est toujours de rester à la maison au moindre symptôme, pour éviter de se déplacer dans la société et de propager l'infection. C'est la raison pour laquelle nous avons choisi de ne pas tester un groupe spécifique, parce qu'il y a toujours une importante pénurie de ressources au niveau mondial, ce qui signifie que nous devons cibler les efforts là où ils font la différence, comme pour le personnel des maisons de retraite et des centres de soins. Ensuite, les fonctions sociétales critiques, puis l'étape suivante, pour faire travailler davantage de personnes. Les tests d'anticorps sont donc inclus dans cette stratégie. -Les tests plus ciblés, dans les soins aux personnes âgées, n'arrivent-ils pas un peu tard ? Nous avons toujours recommandé les tests dans les soins aux personnes âgées.","2020-04-17"
5,202004171,"202004171_292","Ils effectuent ensuite des prélèvements à domicile, ce qui a lieu cette semaine. Comme pour l'enquête de Stockholm, nous bénéficions d'un excellent soutien logistique de la part des forces armées suédoises. Nous ramenons ensuite les échantillons à la maison, puis nous les analysons la semaine prochaine, parallèlement à la collecte de nouveaux échantillons chaque jour. Nous espérons que l'analyse sera terminée au cours de la semaine 18. Nous collectons les échantillons au cours de la semaine 17, nous les analysons, nous examinons les analyses statistiques, puis nous les analysons à un moment donné. Nous espérons pouvoir obtenir une sorte de chiffre moyen dès le début, puis il faut plus de temps pour examiner les corrélations statistiques entre les symptômes. La collecte a lieu à la semaine 17, l'analyse à la semaine 18, et j'espère que nous pourrons dire quelque chose vers la semaine 19"" -Emanuel Karlsten -Anders Tegnell a expliqué hier qu'il pensait que la Suède atteindrait l'immunité collective avant d'avoir un vaccin. Même si cela réduirait la propagation parmi les personnes en bonne santé, cela signifie que nous devons protéger les personnes âgées et les malades chroniques en particulier. Qu'en sera-t-il pour les groupes à risque ? Pensez-vous que les personnes âgées et les malades chroniques puissent se déplacer librement avant d'être immunisés ? Selon la durée de l'immunité, l'infection ne pourra pas être transmise entre les personnes.","2020-04-17"
1,202004211,"202004211_108","La capacité est en train d'être mise en place - davantage de laboratoires sont connectés. Mais il y a deux choses - les analyses dans les soins de santé n'ont pas augmenté autant qu'elles le pourraient. Mais aussi, ce type de capacité peut devenir un effet ketchup, lorsque beaucoup de choses sont ajoutées soudainement - lorsque toutes les étapes, dans un long processus, avec les laboratoires, les analyses et ainsi de suite - lorsqu'elles sont en place, beaucoup de choses sont libérées. La stratégie a été présentée vendredi, et cela se produira dans un avenir proche. Ce sera probablement un peu plus lent au début, puis cela augmentera considérablement"" -Dagens Nyheter : Vous avez dit qu'il y a un cas confirmé de COVID-19 pour mille tests. Cela signifie-t-il que les autres ont des symptômes si légers qu'ils ne sont pas remarqués ? -Pas nécessairement, mais plutôt qu'ils sont à la maison avec un rhume. Ils n'ont pas eu besoin de consulter un médecin, ou ne l'ont pas fait de toute façon. Combien ont des symptômes si légers qu'ils ne remarquent rien, diriez-vous ? C'est plus difficile à savoir. Il faut alors avoir des réponses logiques, à partir de ces études, et savoir qu'ils n'avaient pas de symptômes lorsqu'ils étaient malades. Nous ne disposons pas de cette information. Dans ces études, je me suis rendu compte après coup qu'ils avaient peut-être des symptômes plus légers, quand on y regarde de plus près. La frontière est mince entre des symptômes vagues et pas de symptômes du tout. Mais beaucoup ont des symptômes légers. Tt, au Conseil national de la santé et du bien-être : Vous parlez du défi que représente la constitution de stocks d'équipements de protection. Quel type d'équipement de protection est actuellement difficile à obtenir ? -Nous manquons actuellement de combinaisons de protection, de blouses à manches longues, avec la qualité et l'étiquetage adéquats. Cela ne signifie pas que les commandes n'ont pas été passées. Elles étaient en route, dans le pipeline, mais ne sont pas apparues.","2020-04-21"
